id,nombre,email,edad,ciudad,fecha_registro
1,Esperanza Carla Ochoa Villanueva,horacio03@trevino-de.com,32,Nueva Iraq,2023-12-16
2,Elisa Genaro de la Crúz Pulido,juan-carlos80@ramos.com,63,Nueva Argelia,2023-08-22
3,Rosalia Caridad Negrón Pabón,adalberto49@proyectos.net,40,Vieja Mongolia,2024-03-07
4,Virginia Araceli Pacheco Lebrón,villaivonne@industrias.com,44,Nueva Liberia,2024-02-06
5,Eduardo Susana Valles Salas,maria-del-carmen28@yahoo.com,27,Vieja Chile,2023-10-26
6,Eva de la Torre,dcastellanos@ceja-lebron.org,32,Nueva Iraq,2025-04-03
7,José Carlos Carlos Segovia Gómez,icasares@gmail.com,25,Vieja Perú,2024-11-10
8,Francisco Javier Jorge Luis Matos Herrera,ylovato@industrias.info,22,San Emilia los bajos,2024-02-05
9,Porfirio Sevilla,marcelavalladares@cepeda.biz,51,Vieja Timor-Leste,2024-11-07
10,Lic. Pamela Burgos,ramoseva@gmail.com,30,Nueva Paraguay,2023-08-03
11,Jesús Rodrigo Collazo,elsa87@corporacin.com,24,San Linda los altos,2024-12-25
12,Cecilia Ricardo Jimínez,nazarioyuridia@iglesias.com,42,Vieja Cuba,2025-05-19
13,Jorge Pacheco Narváez,sbarrios@yahoo.com,39,San María del Carmen los bajos,2024-04-05
14,Reina Tamayo,soledadleon@gmail.com,59,San Angélica los altos,2023-11-30
15,Dolores de la O Velázquez,camilo46@hotmail.com,40,San Samuel de la Montaña,2025-06-19
16,Laura Pacheco,gloria62@yahoo.com,49,San Cecilia los altos,2025-04-30
17,Amalia Gamboa,claudia11@industrias.net,37,Nueva Liechtenstein,2024-03-18
18,Gabriel Chavarría,rubiobernardo@fajardo.org,42,Nueva Mónaco,2024-05-03
19,Amelia Cruz,paulinamuniz@corporacin.net,18,Nueva Israel,2024-03-17
20,Modesto Adalberto Macías,teranlourdes@yahoo.com,49,Nueva Albania,2023-06-22
21,Cornelio Ángel Rangel Orozco,lorena51@hotmail.com,32,Vieja Guatemala,2023-06-28
22,Aldonza Cristobal Cortés,nelly02@gurule.biz,19,Nueva San Marino,2024-05-08
23,Dr. Clemente Villa,alonsorenato@grupo.info,22,San Anel los bajos,2025-05-23
24,Marcela Caraballo,nelly30@gmail.com,47,Nueva China,2023-12-23
25,Luis Manuel Eugenia Feliciano Alvarez,octavio65@hotmail.com,62,San Antonia los altos,2023-09-04
26,Mtro. Citlali Pichardo,navarretepascual@yahoo.com,37,San Lorenzo los altos,2025-04-30
27,Ángel Galarza Gonzales,eveliovigil@yahoo.com,64,Vieja Alemania,2024-05-07
28,Dr. Zeferino Madrid,cynthiairizarry@jiminez.com,50,San Martín de la Montaña,2025-01-28
29,Rodrigo Gabino Pantoja,carlotacardenas@yahoo.com,42,Nueva Ecuador,2024-09-29
30,Lic. Joaquín Regalado,pamela71@hotmail.com,22,Nueva Congo,2024-07-20
31,Teresa Norma Murillo,emilio90@gmail.com,34,Nueva Guinea Bissau,2024-08-16
32,Hermelinda Caldera,saenznancy@velasquez.com,39,Vieja República de Moldova,2023-06-20
33,José Pascual Escalante Holguín,trendon@hotmail.com,50,Vieja Chipre,2025-02-10
34,Noelia Estefanía Jaramillo,zeferino78@gmail.com,63,Vieja Serbia,2024-09-07
35,Eva Alejandra Franco,adrianaperea@de.com,50,San Cristobal de la Montaña,2024-08-01
36,Blanca Pantoja Cedillo,pascual70@gmail.com,26,Vieja ex República Yugoslava de Macedonia,2024-01-29
37,Lic. Andrés Aguirre,homeroruiz@hotmail.com,63,Vieja Islas Salomón,2023-08-30
38,Rubén Collazo Elizondo,rocio65@despacho.info,32,Nueva El Salvador,2023-11-27
39,Daniela Maldonado Porras,leticiareyes@gmail.com,35,Vieja Japón,2024-11-19
40,Luz Wilfrido Baeza,ovillegas@yahoo.com,57,Nueva Burundi,2024-06-22
41,María Luisa Galarza,qpantoja@yahoo.com,50,San Clemente de la Montaña,2024-12-30
42,Ángel Zamudio Cornejo,vallesrufino@gmail.com,27,San Claudia los altos,2023-11-21
43,Gloria Lilia Apodaca Bustamante,cedillohilda@yahoo.com,56,Nueva Samoa,2024-01-27
44,Miguel Prado,gchavarria@hotmail.com,26,Nueva Cuba,2025-01-15
45,Marisol Aurora Valdivia Urbina,jonaspalomino@hotmail.com,25,Vieja Montenegro,2024-06-15
46,Elias Wilfrido Lovato Cisneros,nicolascano@yahoo.com,49,Nueva Barbados,2023-12-26
47,Lic. Sonia Muñiz,carreraelena@despacho.com,30,Nueva Kazajstán,2025-03-24
48,Jacinto Nieto,raul63@arenas-casanova.com,42,Nueva Turkmenistán,2025-01-21
49,Ana Luisa Elvira López,opaz@orosco.com,58,Nueva Dominicana,2023-08-14
50,Patricio Miguel Ángel Sáenz,camilaquintana@yahoo.com,47,San Elvira los altos,2024-09-12
51,Abelardo Marco Antonio Rolón,santillanangela@yahoo.com,57,San Alicia de la Montaña,2025-04-08
52,Sr(a). Manuel Batista,chavarriaitzel@correa.com,51,Vieja Sierra Leona,2024-06-08
53,Isabel Sara Roldán Cedillo,joseolivarez@industrias.com,28,Vieja Paraguay,2024-10-07
54,Óscar Vásquez,luz21@hotmail.com,30,Nueva Camboya,2023-12-10
55,Martha Garza,liliaquintana@club.biz,45,Vieja Japón,2024-04-17
56,Amador Ruby Gutiérrez,carrilloalejandro@vargas.com,28,San Citlali de la Montaña,2025-03-15
57,Isabela Camila Luna Negrón,marthaperales@yahoo.com,39,Nueva Australia,2024-11-28
58,Manuel Alonso Pichardo,carlotaiglesias@hotmail.com,56,Vieja Países Bajos,2023-12-13
59,María del Carmen Orellana Trejo,estefaniaveliz@hotmail.com,28,San Ramiro los bajos,2023-08-02
60,Lic. Eugenia Gálvez,wmontalvo@leal.com,26,San Zoé los altos,2024-10-17
61,Elena Leal Orozco,daniela87@mendez-sevilla.net,44,San Rodolfo los altos,2023-11-27
62,Homero Macías Lira,serafin91@borrego-munguia.info,44,Nueva Estados Unidos de América,2025-06-04
63,Mauricio Paola Sandoval,brosado@ballesteros-olivera.com,64,San Mariano de la Montaña,2025-06-19
64,Cristina Perea,casanovadulce-maria@zamudio.com,58,San Natividad los bajos,2023-07-21
65,Rolando Porfirio Bueno Guzmán,renato08@yahoo.com,54,San Guillermo los bajos,2023-10-07
66,Raúl Sarabia Covarrubias,urrutiaarcelia@proyectos.info,49,San Wendolin los bajos,2024-11-09
67,José María María José Corrales,yuridiaaparicio@proyectos.com,18,San Elvira de la Montaña,2025-05-28
68,Dr. Leonor Salas,mario24@gmail.com,23,Vieja Dominicana,2024-01-13
69,Abigail Escobar,coronadotimoteo@gmail.com,51,Nueva Omán,2023-08-13
70,Luz Hugo Jaramillo Granado,patriciasalgado@industrias.com,41,San Sonia de la Montaña,2023-06-23
71,Catalina Margarita Crespo,xcervantes@yahoo.com,21,Nueva Guyana,2024-09-02
72,Sara Elvira Mota Rubio,ursula72@reyna-coronado.biz,41,Nueva República Árabe Siria,2024-02-19
73,José Eduardo Yuridia Palomino,conchitamercado@hotmail.com,52,Vieja Malasia,2024-02-01
74,Ángel Yolanda Loera Carreón,huertarosario@mondragon.com,43,Nueva Papua Nueva Guinea,2024-02-19
75,Espartaco Medina Treviño,karina30@yahoo.com,39,San Ilse los bajos,2023-10-07
76,Enrique Victoria Moreno Abreu,dulcecortez@hotmail.com,40,Nueva Zambia,2024-12-12
77,Rebeca Catalina Ibarra Maya,santiagoduenas@hotmail.com,43,Vieja Etiopía,2024-04-04
78,Zeferino Martínez Casanova,ofeliacenteno@hotmail.com,26,Nueva Kenya,2024-09-05
79,Mtro. Adriana Ramos,luisa77@nevarez.org,52,Nueva Albania,2025-02-12
80,Mtro. Marcela Miramontes,oliver68@morales-tovar.com,25,Vieja Dinamarca,2025-04-25
81,Enrique Victoria Lemus Villaseñor,cardonaminerva@yahoo.com,50,San Gonzalo de la Montaña,2024-02-01
82,Dr. Evelio Razo,ksandoval@hotmail.com,55,San César los altos,2024-08-03
83,Lic. Daniela Negrete,angel69@industrias.biz,23,San Elias de la Montaña,2024-02-01
84,Lorenzo Andrés Dueñas,nvarela@hotmail.com,38,San Gonzalo los altos,2024-11-02
85,Juan Carlos Estela Riojas Jiménez,ybarrajorge@industrias.com,34,Vieja Cuba,2023-11-10
86,Ing. Ernesto López,carolina93@gmail.com,20,San Raúl de la Montaña,2025-05-14
87,Eugenia Soliz,gabino73@yahoo.com,27,San Alonso los bajos,2024-05-19
88,Magdalena Espartaco Pabón Portillo,ssalas@ulibarri.net,46,San Ana María los bajos,2024-12-27
89,Sr(a). Bernabé Rolón,emiliano45@hotmail.com,59,Vieja Luxemburgo,2024-07-20
90,Sr(a). Yeni Fonseca,zcazares@industrias.org,59,Nueva Antigua y Barbuda,2024-05-05
91,Dr. Samuel Córdova,mercedes22@hotmail.com,35,San Julio los bajos,2023-07-30
92,Ramiro Valentín Delgado,juan59@industrias.com,44,San Liliana los bajos,2025-03-14
93,Silvano Villagómez,zcarrera@laboratorios.org,26,Vieja Iraq,2023-07-29
94,Dr. Blanca Alcaraz,emiliamejia@yahoo.com,52,San Clara de la Montaña,2024-01-04
95,Lic. Teodoro Meza,bamador@yahoo.com,42,San Gabino los altos,2024-03-03
96,Dr. Ángela Chapa,zquintero@yahoo.com,29,Nueva Namibia,2024-10-12
97,Darío Jorge Sanches Arias,guillermo48@corona.biz,29,Nueva Argentina,2025-05-10
98,Abraham Bermúdez,navarretenatividad@ocampo.com,46,Nueva Honduras,2024-08-26
99,Teodoro Julia Palacios,fidelmolina@gmail.com,53,San Verónica los bajos,2023-12-27
100,Pilar Villagómez Armas,garzaesparta@proyectos.com,40,San Salma los bajos,2023-09-28
